{
  "governance": {
    "date": "2026-04-28",
    "region": "US",
    "market_session": "post",
    "published_ts": "2026-04-28T20:00:00Z",
    "asof_ts": "2026-04-28T16:00:00Z",
    "universe_scope": "SPX",
    "doc_version": 1,
    "trust_tier": 1,
    "license_policy": "internal_synthetic",
    "market_data_vendor": "Massive",
    "market_data_version": "massive_bars_v3",
    "calc_versions": [
      "technicals_v1.2.1",
      "impact_v1.0.1"
    ],
    "pipeline_version": "v2.2.0",
    "doc_id": "8e77ce14-6e69-4be1-ace8-9daf9531c260",
    "doc_key": "market_wrap/us/2026-04-28",
    "is_current": true,
    "is_active": true,
    "sources_used": [
      {
        "source_name": "Massive",
        "source_type": "market_data",
        "count": 0,
        "max_age_days": 0
      },
      {
        "source_name": "SyntheticWire",
        "source_type": "news_wire_synthetic",
        "count": 0,
        "max_age_days": 0
      }
    ]
  },
  "market_outcomes": {
    "headline_neutral": "US equities: SPX -0.96%, NDX -0.89%, DJIA -0.34%, RUT -1.07%.",
    "indices": [
      {
        "symbol": "SPX",
        "close": 4893.72,
        "return_pct": -0.96,
        "high": 4919.59,
        "low": 4874.81
      },
      {
        "symbol": "NDX",
        "close": 19106.16,
        "return_pct": -0.89,
        "high": 19216.77,
        "low": 19067.94
      },
      {
        "symbol": "RUT",
        "close": 2146.45,
        "return_pct": -1.07
      },
      {
        "symbol": "DJIA",
        "close": 37930.1,
        "return_pct": -0.34
      },
      {
        "symbol": "QQQ",
        "close": 471.5,
        "return_pct": -0.85
      },
      {
        "symbol": "IWM",
        "close": 215.13,
        "return_pct": -0.67
      }
    ],
    "rates_fx_commodities": [
      {
        "symbol": "UST 2Y",
        "value": 4.17,
        "unit": "bps",
        "change": 2.6
      },
      {
        "symbol": "UST 10Y",
        "value": 4.41,
        "unit": "bps",
        "change": 2.9
      },
      {
        "symbol": "DXY",
        "value": 102.66,
        "unit": "index",
        "change": 0.2
      },
      {
        "symbol": "EURUSD",
        "value": 1.0789,
        "unit": "index",
        "change": 0.11
      },
      {
        "symbol": "WTI Crude",
        "value": 76.36,
        "unit": "usd",
        "change": 0.74
      },
      {
        "symbol": "Gold",
        "value": 2030.84,
        "unit": "usd",
        "change": -0.71
      }
    ],
    "volatility": [
      {
        "symbol": "VIX",
        "close": 14.98,
        "change": -0.65
      },
      {
        "symbol": "VIX9D",
        "close": 16.53,
        "change": 0.7
      }
    ],
    "breadth": {
      "advancers": 2475,
      "decliners": 2274,
      "pct_above_200dma": 43.5
    }
  },
  "events": [
    {
      "event_id": "evt_economic_release_2026-04-28_4",
      "event_type": "economic_release",
      "published_ts": "2026-04-28T16:30:00Z",
      "market_session": "regular",
      "facts": [
        "economic_release event recorded for 2026-04-28."
      ],
      "source": {
        "name": "SyntheticWire",
        "source_type": "news_wire_synthetic",
        "canonical_url": "synthetic://wire/2026-04-28/evt_economic_release_2026-04-28_4"
      },
      "entities": [
        "SPX",
        "NDX"
      ]
    },
    {
      "event_id": "evt_fed_speech_2026-04-28_5",
      "event_type": "fed_speech",
      "published_ts": "2026-04-28T17:12:00Z",
      "market_session": "regular",
      "facts": [
        "fed_speech event recorded for 2026-04-28."
      ],
      "source": {
        "name": "SyntheticWire",
        "source_type": "news_wire_synthetic",
        "canonical_url": "synthetic://wire/2026-04-28/evt_fed_speech_2026-04-28_5"
      },
      "entities": [
        "SPX",
        "NDX"
      ]
    },
    {
      "event_id": "evt_economic_release_2026-04-28_3",
      "event_type": "economic_release",
      "published_ts": "2026-04-28T17:15:00Z",
      "market_session": "regular",
      "facts": [
        "economic_release event recorded for 2026-04-28."
      ],
      "source": {
        "name": "SyntheticWire",
        "source_type": "news_wire_synthetic",
        "canonical_url": "synthetic://wire/2026-04-28/evt_economic_release_2026-04-28_3"
      },
      "entities": [
        "SPX",
        "NDX"
      ]
    },
    {
      "event_id": "evt_economic_release_2026-04-28_2",
      "event_type": "economic_release",
      "published_ts": "2026-04-28T18:09:00Z",
      "market_session": "regular",
      "facts": [
        "economic_release event recorded for 2026-04-28."
      ],
      "source": {
        "name": "SyntheticWire",
        "source_type": "news_wire_synthetic",
        "canonical_url": "synthetic://wire/2026-04-28/evt_economic_release_2026-04-28_2"
      },
      "entities": [
        "SPX",
        "NDX"
      ]
    },
    {
      "event_id": "evt_treasury_auction_2026-04-28_6",
      "event_type": "treasury_auction",
      "published_ts": "2026-04-28T19:19:00Z",
      "market_session": "regular",
      "facts": [
        "treasury_auction event recorded for 2026-04-28."
      ],
      "source": {
        "name": "SyntheticWire",
        "source_type": "news_wire_synthetic",
        "canonical_url": "synthetic://wire/2026-04-28/evt_treasury_auction_2026-04-28_6"
      },
      "entities": [
        "SPX",
        "NDX"
      ]
    },
    {
      "event_id": "evt_corporate_action_2026-04-28_1",
      "event_type": "corporate_action",
      "published_ts": "2026-04-28T21:15:00Z",
      "market_session": "post",
      "facts": [
        "CVX announced a corporate action filing.",
        "Record date: 2026-05-16"
      ],
      "source": {
        "name": "SEC",
        "source_type": "regulatory_filing_synthetic",
        "canonical_url": "synthetic://sec/edgar/data/0000000000/2026-04-28/CVX/event"
      },
      "entities": [
        "CVX",
        "SPX",
        "Energy"
      ]
    }
  ],
  "reaction_windows": [
    {
      "event_id": "evt_economic_release_2026-04-28_4",
      "instrument": "SPX",
      "window": "t0_to_t+60m",
      "move_pct": -0.07
    },
    {
      "event_id": "evt_economic_release_2026-04-28_4",
      "instrument": "NDX",
      "window": "t0_to_t+60m",
      "move_pct": -0.094
    },
    {
      "event_id": "evt_economic_release_2026-04-28_4",
      "instrument": "DJIA",
      "window": "t0_to_t+60m",
      "move_pct": -0.539
    },
    {
      "event_id": "evt_economic_release_2026-04-28_4",
      "instrument": "RUT",
      "window": "t0_to_t+60m",
      "move_pct": -0.331
    },
    {
      "event_id": "evt_economic_release_2026-04-28_4",
      "instrument": "VIX",
      "window": "t0_to_t+60m",
      "move_pct": 0.221
    },
    {
      "event_id": "evt_economic_release_2026-04-28_4",
      "instrument": "TSLA",
      "window": "t0_to_t+30m",
      "move_pct": 0.287
    },
    {
      "event_id": "evt_economic_release_2026-04-28_4",
      "instrument": "HON",
      "window": "pre_to_close",
      "move_pct": 0.302
    },
    {
      "event_id": "evt_economic_release_2026-04-28_4",
      "instrument": "UPS",
      "window": "pre_to_close",
      "move_pct": -1.259
    },
    {
      "event_id": "evt_fed_speech_2026-04-28_5",
      "instrument": "SPX",
      "window": "t0_to_t+60m",
      "move_pct": -0.264
    },
    {
      "event_id": "evt_fed_speech_2026-04-28_5",
      "instrument": "NDX",
      "window": "t0_to_t+60m",
      "move_pct": 0.016
    },
    {
      "event_id": "evt_fed_speech_2026-04-28_5",
      "instrument": "DJIA",
      "window": "t0_to_t+60m",
      "move_pct": -0.221
    },
    {
      "event_id": "evt_fed_speech_2026-04-28_5",
      "instrument": "RUT",
      "window": "t0_to_t+60m",
      "move_pct": -0.581
    },
    {
      "event_id": "evt_fed_speech_2026-04-28_5",
      "instrument": "VIX",
      "window": "t0_to_t+60m",
      "move_pct": -0.107
    },
    {
      "event_id": "evt_fed_speech_2026-04-28_5",
      "instrument": "GE",
      "window": "t0_to_t+30m",
      "move_pct": -0.375
    },
    {
      "event_id": "evt_fed_speech_2026-04-28_5",
      "instrument": "BAC",
      "window": "t0_to_t+60m",
      "move_pct": -0.619
    },
    {
      "event_id": "evt_fed_speech_2026-04-28_5",
      "instrument": "MCD",
      "window": "t0_to_t+60m",
      "move_pct": -0.829
    },
    {
      "event_id": "evt_economic_release_2026-04-28_3",
      "instrument": "SPX",
      "window": "t0_to_t+60m",
      "move_pct": 0.111
    },
    {
      "event_id": "evt_economic_release_2026-04-28_3",
      "instrument": "NDX",
      "window": "t0_to_t+60m",
      "move_pct": 0.075
    },
    {
      "event_id": "evt_economic_release_2026-04-28_3",
      "instrument": "DJIA",
      "window": "t0_to_t+60m",
      "move_pct": -0.305
    },
    {
      "event_id": "evt_economic_release_2026-04-28_3",
      "instrument": "RUT",
      "window": "t0_to_t+60m",
      "move_pct": -0.196
    },
    {
      "event_id": "evt_economic_release_2026-04-28_3",
      "instrument": "VIX",
      "window": "t0_to_t+60m",
      "move_pct": 0.171
    },
    {
      "event_id": "evt_economic_release_2026-04-28_3",
      "instrument": "BAC",
      "window": "t0_to_t+60m",
      "move_pct": 0.771
    },
    {
      "event_id": "evt_economic_release_2026-04-28_3",
      "instrument": "GE",
      "window": "pre_to_close",
      "move_pct": -1.166
    },
    {
      "event_id": "evt_economic_release_2026-04-28_3",
      "instrument": "MCD",
      "window": "pre_to_close",
      "move_pct": -1.032
    },
    {
      "event_id": "evt_economic_release_2026-04-28_2",
      "instrument": "SPX",
      "window": "t0_to_t+60m",
      "move_pct": -1.236
    },
    {
      "event_id": "evt_economic_release_2026-04-28_2",
      "instrument": "NDX",
      "window": "t0_to_t+60m",
      "move_pct": -0.6
    },
    {
      "event_id": "evt_economic_release_2026-04-28_2",
      "instrument": "DJIA",